{
  "$schema": "https://json-schema.org/draft/2020-12/schema",
  "$id": "https://one-health-lyme-gap-atlas.example/contracts/tick-surveillance/v1",
  "title": "Atlas canonical tick-surveillance observation v1",
  "type": "object",
  "additionalProperties": false,
  "required": [
    "canonical_observation_id",
    "observation_type",
    "tick_species",
    "source_agency",
    "source_dataset_id",
    "source_record_id",
    "data_source_version_id",
    "ingestion_run_id",
    "artifact_id",
    "retrieved_at",
    "method_version",
    "quality_flags"
  ],
  "properties": {
    "canonical_observation_id": {"type": "string", "minLength": 1},
    "observation_type": {
      "enum": [
        "VECTOR_PRESENCE_STATUS",
        "COLLECTION_ABUNDANCE",
        "PATHOGEN_PRESENCE_STATUS",
        "PATHOGEN_TESTING"
      ]
    },
    "county_fips": {"type": "string", "pattern": "^[0-9]{5}$"},
    "native_sampling_grain": {
      "type": ["string", "null"],
      "enum": ["COUNTY_STATUS", "SITE_EVENT", "OTHER", null]
    },
    "sampling_site": {
      "type": ["object", "null"],
      "additionalProperties": false,
      "required": ["source_site_id"],
      "properties": {
        "source_site_id": {"type": "string", "minLength": 1},
        "source_plot_id": {"type": ["string", "null"]},
        "source_location_id": {"type": ["string", "null"]}
      }
    },
    "sampling_event": {
      "type": ["object", "null"],
      "additionalProperties": false,
      "required": ["source_event_id"],
      "properties": {
        "source_event_id": {"type": "string", "minLength": 1},
        "source_sample_id": {"type": ["string", "null"]},
        "source_subsample_id": {"type": ["string", "null"]},
        "source_testing_id": {"type": ["string", "null"]},
        "source_batch_id": {"type": ["string", "null"]},
        "source_replicate_id": {"type": ["string", "null"]}
      }
    },
    "source_geography": {
      "type": ["object", "null"],
      "additionalProperties": false,
      "required": ["source_location_id", "geography_kind", "coordinate_reference_system", "longitude", "latitude", "spatial_uncertainty_meters"],
      "properties": {
        "source_location_id": {"type": "string", "minLength": 1},
        "geography_kind": {"enum": ["SITE", "PLOT", "POINT", "POLYGON", "OTHER"]},
        "coordinate_reference_system": {"type": ["string", "null"]},
        "longitude": {"type": ["number", "null"], "minimum": -180, "maximum": 180},
        "latitude": {"type": ["number", "null"], "minimum": -90, "maximum": 90},
        "spatial_uncertainty_meters": {"type": ["number", "null"], "minimum": 0},
        "reported_geometry": {"type": ["object", "null"]}
      }
    },
    "harmonized_geography": {
      "type": ["object", "null"],
      "additionalProperties": false,
      "required": ["geography_kind", "method", "method_version"],
      "properties": {
        "geography_kind": {"enum": ["SITE", "PLOT", "POINT", "POLYGON", "OTHER"]},
        "method": {"type": "string", "minLength": 1},
        "method_version": {"type": "string", "minLength": 1}
      }
    },
    "county_relationship": {
      "type": ["object", "null"],
      "additionalProperties": false,
      "required": ["mapping_status", "county_fips", "mapping_method", "mapping_version", "mapping_artifact_id", "representativeness"],
      "properties": {
        "mapping_status": {"enum": ["SOURCE_REPORTED_COUNTY", "ATLAS_DERIVED_MATCH", "UNMAPPED", "AMBIGUOUS"]},
        "county_fips": {"type": ["string", "null"], "pattern": "^[0-9]{5}$"},
        "mapping_method": {"type": ["string", "null"]},
        "mapping_version": {"type": ["string", "null"]},
        "mapping_artifact_id": {"type": ["string", "null"]},
        "representativeness": {"const": "NOT_COUNTY_REPRESENTATIVE"}
      }
    },
    "state_fips": {"type": ["string", "null"], "pattern": "^[0-9]{2}$"},
    "source_location_id": {"type": ["string", "null"]},
    "observation_date": {"type": ["string", "null"], "format": "date"},
    "observation_year": {"type": ["integer", "null"], "minimum": 1900, "maximum": 2200},
    "season": {
      "type": ["string", "null"],
      "enum": ["WINTER", "SPRING", "SUMMER", "FALL", "NYMPH", "ADULT", "ANNUAL", null]
    },
    "surveillance_period_start": {"type": ["string", "null"], "format": "date"},
    "surveillance_period_end": {"type": ["string", "null"], "format": "date"},
    "temporal_semantics": {
      "enum": ["POINT_IN_TIME", "PERIOD", "ANNUAL", "CUMULATIVE_THROUGH_DATE"]
    },
    "tick_species": {"type": "string", "minLength": 1},
    "life_stage": {
      "type": ["string", "null"],
      "enum": ["LARVA", "NYMPH", "ADULT", "MIXED", "NOT_REPORTED", null]
    },
    "sex": {
      "type": ["string", "null"],
      "enum": ["FEMALE", "MALE", "MIXED", "NOT_REPORTED", "NOT_APPLICABLE", null]
    },
    "presence_status": {
      "type": ["string", "null"],
      "enum": ["ESTABLISHED", "REPORTED", "PRESENT", "NO_RECORDS", null]
    },
    "collection_method": {"type": ["string", "null"]},
    "collection_effort_value": {"type": ["number", "null"], "minimum": 0},
    "collection_effort_unit": {"type": ["string", "null"]},
    "area_sampled_hectares": {"type": ["number", "null"], "minimum": 0},
    "distance_sampled_meters": {"type": ["number", "null"], "minimum": 0},
    "duration_sampled_minutes": {"type": ["number", "null"], "minimum": 0},
    "site_count": {"type": ["integer", "null"], "minimum": 0},
    "replicate_count": {"type": ["integer", "null"], "minimum": 0},
    "ticks_collected": {"type": ["integer", "null"], "minimum": 0},
    "abundance_value": {"type": ["number", "null"], "minimum": 0},
    "abundance_unit": {"type": ["string", "null"]},
    "pathogen_name": {"type": ["string", "null"]},
    "ticks_tested": {"type": ["integer", "null"], "minimum": 0},
    "ticks_positive": {"type": ["integer", "null"], "minimum": 0},
    "prevalence": {"type": ["number", "null"], "minimum": 0, "maximum": 1},
    "source_agency": {"type": "string", "minLength": 1},
    "source_dataset_id": {"type": "string", "minLength": 1},
    "source_record_id": {"type": "string", "minLength": 1},
    "data_source_version_id": {"type": "string", "minLength": 1},
    "ingestion_run_id": {"type": "string", "minLength": 1},
    "artifact_id": {"type": "string", "minLength": 1},
    "retrieved_at": {"type": "string", "format": "date-time"},
    "method_version": {"enum": ["tick-surveillance-v1", "tick-surveillance-v1.1", "tick-surveillance-v1.2"]},
    "reported_or_derived": {"enum": ["REPORTED", "HARMONIZED", "DERIVED"]},
    "harmonization_method": {"type": ["string", "null"]},
    "normalization": {
      "type": ["object", "null"],
      "additionalProperties": false,
      "required": ["registry_id", "registry_version", "mappings"],
      "properties": {
        "registry_id": {"const": "tick-surveillance-normalization-v1"},
        "registry_version": {"type": "string", "pattern": "^1\\.[0-9]+\\.[0-9]+$"},
        "mappings": {
          "type": "object",
          "additionalProperties": {
            "type": "object",
            "additionalProperties": false,
            "required": ["source_value", "canonical_id", "canonical_label", "status", "mapping_rule_id", "registry_id", "registry_version", "source_context"],
            "properties": {
              "source_value": {"type": ["string", "number", "boolean"]},
              "canonical_id": {"type": ["string", "null"]},
              "canonical_label": {"type": ["string", "null"]},
              "status": {"enum": ["APPROVED", "UNKNOWN", "UNSUPPORTED", "AMBIGUOUS"]},
              "mapping_rule_id": {"type": ["string", "null"]},
              "registry_id": {"const": "tick-surveillance-normalization-v1"},
              "registry_version": {"type": "string", "pattern": "^1\\.[0-9]+\\.[0-9]+$"},
              "source_context": {"type": "object", "additionalProperties": false, "required": ["publisher", "dataset_id", "source_version"], "properties": {"publisher": {"type": "string"}, "dataset_id": {"type": "string"}, "source_version": {"type": "string"}}}
            }
          }
        }
      }
    },
    "missingness": {
      "type": "object",
      "additionalProperties": {
        "enum": ["PRESENT", "NULL", "UNKNOWN", "SUPPRESSED", "NOT_REPORTED", "NOT_APPLICABLE"]
      }
    },
    "quality_flags": {"type": "array", "items": {"type": "string"}, "uniqueItems": true},
    "limitations": {"type": "array", "items": {"type": "string"}}
  },
  "allOf": [
    {
      "if": {"properties": {"observation_type": {"const": "VECTOR_PRESENCE_STATUS"}}},
      "then": {"required": ["county_fips", "presence_status", "temporal_semantics", "reported_or_derived"]}
    },
    {
      "if": {"properties": {"observation_type": {"const": "COLLECTION_ABUNDANCE"}}},
      "then": {"required": ["ticks_collected", "reported_or_derived"]}
    },
    {
      "if": {"properties": {"observation_type": {"const": "PATHOGEN_PRESENCE_STATUS"}}},
      "then": {
        "required": [
          "county_fips",
          "pathogen_name",
          "presence_status",
          "temporal_semantics",
          "reported_or_derived"
        ]
      }
    },
    {
      "if": {"properties": {"observation_type": {"const": "PATHOGEN_TESTING"}}},
      "then": {"required": ["pathogen_name", "ticks_tested", "ticks_positive", "reported_or_derived"]}
    },
    {
      "if": {"properties": {"native_sampling_grain": {"const": "SITE_EVENT"}}, "required": ["native_sampling_grain"]},
      "then": {"required": ["sampling_site", "sampling_event", "source_geography", "county_relationship"]}
    },
    {
      "if": {"properties": {"county_relationship": {"properties": {"mapping_status": {"enum": ["SOURCE_REPORTED_COUNTY", "ATLAS_DERIVED_MATCH"]}}, "required": ["mapping_status"]}}, "required": ["county_relationship"]},
      "then": {"properties": {"county_relationship": {"properties": {"county_fips": {"type": "string"}, "mapping_method": {"type": "string"}, "mapping_version": {"type": "string"}, "mapping_artifact_id": {"type": "string"}}}}}
    },
    {
      "if": {"properties": {"county_relationship": {"properties": {"mapping_status": {"enum": ["UNMAPPED", "AMBIGUOUS"]}}, "required": ["mapping_status"]}}, "required": ["county_relationship"]},
      "then": {"properties": {"county_relationship": {"properties": {"county_fips": {"type": "null"}}}}}
    }
  ]
}
